,Comment ID,Body
249,hto8rhu,cherry waves by deftones
250,htohmb7,I’d say [Lacrymosa](https://youtu.be/fwXGGGHVE7A) is up there.
251,htpc3o7,Young and Beautiful by Lana del Rey
252,htotgqc,Lovers spit - broken social scene
253,hto6w4k,Simple Man
254,htpcdfn,"Purple Rain by Prince has gotta be high up there, especially when the solo kicks in."
255,htoszat,This Woman’s Work - by Kate Bush 🥺
256,htp0n4s,Old Man by Neil Young
257,htp54i2,3 Libras - A Perfect Circle
258,htpnbrd,Do you realize?? - The flaming Lips
259,htom0ja,The Winner Takes it All by Abba
260,htorqjr,“I Cum Blood” by Cannibal Corpse.
261,htolhvs,On the nature of daylight by max ritcher
262,hto8dhh,It’s all Coming Back to Me Now
263,htoa5d2,"Faithfully by Journey  
Or Hard to Say I'm Sorry by Chicago

Or Will you Still Love Me by Chicago"
264,htoi0hh,Where the streets have no name- U2
265,hton12p,"River Man - Nick Drake

Fantasia on a Theme by Thomas Tallis - Ralph Vaugn Williams

Take Me Home Country Road - John Denver

All move me to tears and Fantasia is probably my favourite music of all time."
266,htofwuy,"My answer probably changes every week, but the beauty I need in my life this week is *A Kissed Out Red Floatboat* by Cocteau Twins."
